{
  "schema_version": "1.0.0",
  "package_id": "ocfg-20261001T000000000Z-00000000",
  "canonical_name": "example-skill",
  "version": "0.0.0",
  "author": "UNVERIFIED",
  "license": "UNKNOWN",
  "runtime_compatibility": [],
  "entrypoint": "SKILL.md",
  "capabilities_provided": [],
  "created_utc": "2026-10-01T00:00:00Z"
}
